{
  "source": "reddit",
  "source_id": "jkl012",
  "url": "https://reddit.com/r/diabetes/comments/jkl012",
  "permalink": "/r/diabetes/comments/jkl012",
  "title": "Low blood sugar episodes getting worse",
  "text": "Low blood sugar episodes getting worse. I'm T1D for 15 years and lately my hypoglycemia episodes are more frequent. Sometimes I get shaky and sweaty especially in the mornings. My endo suggested checking my insulin dosing and maybe trying tirzepatide. Anyone else dealing with more frequent lows recently?",
  "subsource": "r/diabetes",
  "author_handle": "u/t1dlife",
  "timestamp": "2024-07-25T11:45:00Z",
  "language": "en",
  "metrics": {
    "likes": 8,
    "comments": 15,
    "shares": 1
  },
  "sentiment_raw": null
}