{
  "source": "reddit",
  "source_id": "ghi789",
  "url": "https://reddit.com/r/loseit/comments/ghi789",
  "permalink": "/r/loseit/comments/ghi789",
  "title": "Weird symptoms after eating since my surgery",
  "text": "Weird symptoms after eating since my surgery. It's been 6 months since my surgery and sometimes after eating I feel really weak and tired. Started taking semaglutide from Novo Nordisk recently too. Not sure if this is normal or something I should worry about. Anyone else have this?",
  "subsource": "r/loseit",
  "author_handle": "u/struggling",
  "timestamp": "2024-07-20T14:22:00Z",
  "language": "en",
  "metrics": {
    "likes": 2,
    "comments": 1,
    "shares": 0
  },
  "sentiment_raw": null
}